{
  "format": "factoria.feedback/1",
  "project": "Larkspur Lodge",
  "engineVersion": "0.2.0",
  "entries": [
    {
      "id": "FB-0001",
      "date": "2026-10-27",
      "reporter": {
        "kind": "ai",
        "agent": "larkspur-p1",
        "model": "claude-sonnet-5-5"
      },
      "category": "ui",
      "severity": "major",
      "title": "Crash when a widget has a parent without a UI component",
      "missing": "Pressing the mouse (or a tap) over any Panel, Button or other widget whose parent entity has no UI component (a plain HUD root with a Transform and a Script) crashes the engine with a segmentation fault (UiSystem::update_drag, engine/ui/src/drag.cpp: ui_box(w, a)->draggable is read for every ancestor while looking for a draggable one, and ui_box is null for an ancestor that is not a widget). Minimal repro: a Panel with a Text child inside an entity that has only a Transform, then game.click on the Panel in a test. Found by clicking the prompt panel of the HUD prefab.",
      "workaround": "The HUD prefab root (prefabs/ui/hud.prefab.json) carries a fully transparent 1x1 Panel with layout none, which is a widget and is never hit, so every widget below it has only widget ancestors. (removed in M33.1)",
      "workaroundFiles": [
        "prefabs/ui/hud.prefab.json"
      ],
      "suggestion": "In update_drag skip an ancestor for which ui_box is null (or stop the walk at the first non-widget), and add a test with a widget under a plain entity. Also worth a validate warning for a widget under a non-widget parent if that layout is not meant to be supported.",
      "effort": "small",
      "occurrences": 2,
      "status": "fixed-in-engine",
      "notes": [
        "2026-10-27 triage: work package M33.1 in feedback/ROADMAP.md.",
        "Fixed in M33.1: update_drag skips an ancestor that is not a widget (the other walks up the UI tree already tolerated one); doctest 'ui tree' in engine/ui/tests. The HUD prefab lost its transparent Panel."
      ]
    },
    {
      "id": "FB-0002",
      "date": "2026-10-27",
      "reporter": {
        "kind": "ai",
        "agent": "larkspur-p1",
        "model": "claude-sonnet-5-5"
      },
      "category": "physics",
      "severity": "minor",
      "title": "No raycast that returns every hit",
      "missing": "physics.raycast3d returns only the first collider along the ray. The camera needs everything between the lens and the porter (every wall and piece of furniture that hides him) to fade it, and the click-to-walk ray must skip the walls that are only there to fade and reach the object behind them.",
      "workaround": "scripts/lodge_camera.js and scripts/porter.js cast again from just past each hit, up to 8 times per ray, with the hit entity in the ignore list. Up to 8 queries per ray, several rays per frame, plus overlapSphere around the lens.",
      "workaroundFiles": [
        "scripts/lodge_camera.js",
        "scripts/porter.js"
      ],
      "suggestion": "physics.raycast3dAll(origin, dir, maxDistance, opts) returning the hits sorted by distance (with a max count), or an option on raycast3d.",
      "effort": "small",
      "occurrences": 1,
      "status": "fixed-in-engine",
      "notes": [
        "2026-10-27 triage: work package M33.7 in feedback/ROADMAP.md.",
        "Fixed in M33.7 (branch m33/raycast-all): physics.raycast3dAll / raycast2dAll return every hit nearest first, up to opts.maxHits; the camera and the porter use them."
      ],
      "engineIssue": "branch m33/raycast-all (M33.7)"
    },
    {
      "id": "FB-0003",
      "date": "2026-10-27",
      "reporter": {
        "kind": "ai",
        "agent": "larkspur-p1",
        "model": "claude-sonnet-5-5"
      },
      "category": "physics",
      "severity": "minor",
      "title": "Collider3D has no enabled field",
      "missing": "A door that has been opened must stop blocking the porter, the camera sweep, the click rays and the NavMesh, but stay in the scene (its open/closed state is saved and the mesh stays visible). Collider3D has isTrigger, layer and mask but nothing to switch it off.",
      "workaround": "scripts/interactable.js removes the component with entity.remove('Collider3D') when the door opens, and a scene that loads with the flag already set does the same. The collider is gone for good, so closing it again would have to add it back.",
      "workaroundFiles": [
        "scripts/interactable.js"
      ],
      "suggestion": "Collider3D.enabled (and Collider2D.enabled), writable at run time, kept out of the NavMesh bake when false; or a documented way to move a collider to a layer that nothing hits.",
      "effort": "small",
      "occurrences": 1,
      "status": "fixed-in-engine",
      "notes": [
        "2026-10-27 triage: work package M33.7 in feedback/ROADMAP.md.",
        "Fixed in M33.7 (branch m33/raycast-all): Collider3D.enabled / Collider2D.enabled, writable at run time; interactable.js now sets enabled = false."
      ],
      "engineIssue": "branch m33/raycast-all (M33.7)"
    },
    {
      "id": "FB-0004",
      "date": "2026-10-27",
      "reporter": {
        "kind": "ai",
        "agent": "larkspur-p2",
        "model": "claude-sonnet-5-5"
      },
      "category": "ui",
      "severity": "minor",
      "title": "No typewriter reveal for a Text",
      "missing": "A dialogue box shows a line letter by letter. Text has no 'visible characters' field, and a markup colour with alpha 0 does not hide the rest of the line, so there is no way to reveal part of a line while the box keeps the size of the whole line.",
      "workaround": "scripts/dialogue_view.js sets the Text to the first n characters followed by one blank line per line break still to come, so the box height does not change while it reveals. The line is wrapped first by wrap() with ui.measureText so it never re-wraps while it grows, and in a headless run ui.measureText only approximates the real width, so the break positions are checked in screenshots.",
      "workaroundFiles": [
        "scripts/dialogue_view.js"
      ],
      "suggestion": "A Text.visibleCharacters field (or a 'reveal' fraction 0..1) that clips the laid-out text without re-laying it out.",
      "effort": "medium",
      "occurrences": 1,
      "status": "fixed-in-engine",
      "notes": [
        "2026-10-27 triage: work package M33.3 in feedback/ROADMAP.md.",
        "Fixed in M33.3 (branch m33/typewriter): Text.visibleCharacters (-1 = all) clips the laid-out text by grapheme clusters without laying it out again; scripts/dialogue_view.js no longer wraps by hand or pads the box with blank lines."
      ]
    },
    {
      "id": "FB-0005",
      "date": "2026-10-27",
      "reporter": {
        "kind": "ai",
        "agent": "larkspur-p2",
        "model": "claude-sonnet-5-5"
      },
      "category": "scripting",
      "severity": "minor",
      "title": "No glob import or file listing for data files",
      "missing": "The story is one JSON table per chapter (data/dialogue/ch1..5.json) and the game and the validator tool must read all of them. A script can import a JSON file by a literal path only, and there is no fs listing for a project folder, so a new table file has to be added to an import list by hand.",
      "workaround": "scripts/dialogue_data.js imports the five files and builds TABLES from them; tools/validate_dialogue.js uses that module, so the list lives in one place. tests/dialogue_data.test.js checks the tables, the story registry and the cast together.",
      "workaroundFiles": [
        "scripts/dialogue_data.js",
        "tools/validate_dialogue.js"
      ],
      "suggestion": "import.meta.glob-like support for JSON data (import tables from \"../data/dialogue/*.json\"), or a project.list_files command a tool can call.",
      "effort": "medium",
      "occurrences": 1,
      "status": "open",
      "notes": [
        "2026-10-27 triage: work package M33.10 in feedback/ROADMAP.md."
      ]
    },
    {
      "id": "FB-0006",
      "date": "2026-10-27",
      "reporter": {
        "kind": "ai",
        "agent": "larkspur-p2",
        "model": "claude-sonnet-5-5"
      },
      "category": "docs",
      "severity": "minor",
      "title": "A Button's key field is a locale key, not a hotkey",
      "missing": "The field name 'key' on Button, Text, Toggle and Slider is the localization key. The choice buttons also answer to the keys 1..4, and nothing on the Button says how to do that: it is an input action that the script reads.",
      "workaround": "Choices answer to the input actions choice_1..choice_4 declared in factoria.json, read in scripts/dialogue_view.js with input.pressed.",
      "workaroundFiles": [
        "factoria.json",
        "scripts/dialogue_view.js"
      ],
      "suggestion": "Say it in the ui doc next to the Button fields (and in the field's doc string), or rename the field in a future format version.",
      "effort": "small",
      "occurrences": 2,
      "status": "open",
      "notes": [
        "2026-10-27 triage: work package M33.15 in feedback/ROADMAP.md."
      ]
    },
    {
      "id": "FB-0007",
      "date": "2026-10-27",
      "reporter": {
        "kind": "ai",
        "agent": "larkspur-p2",
        "model": "claude-sonnet-5-5"
      },
      "category": "docs",
      "severity": "minor",
      "title": "Screen anchor goes down but a widget pivot goes up",
      "missing": "A Panel with anchor [0.5, 1] and pivot [0.5, 0] does not sit on the bottom edge: anchors count Y downwards from the top-left while the pivot of a widget counts Y upwards, so the first version of the dialogue box hung off the bottom of the screen. Only a screenshot showed it, validate did not.",
      "workaround": "The dialogue and ending prefabs use pivot values found by looking at screenshots (prefabs/ui/dialogue.prefab.json).",
      "workaroundFiles": [
        "prefabs/ui/dialogue.prefab.json",
        "prefabs/ui/ending.prefab.json"
      ],